[
  {
    "id": "hotel-97231-001",
    "nom": "Hôtel La Pagerie",
    "description": "Hôtel 4 étoiles avec piscine, restaurant et accès à la plage.",
    "adresse": {
      "ligne1": "La Pagerie",
      "ligne2": "Pointe du Bout",
      "codePostal": "97229",
      "ville": "Les Trois-Îlets",
      "pays": "France"
    },
    "coordonnees": {
      "latitude": 14.5946,
      "longitude": -60.8763
    },
    "classement": "4 étoiles",
    "contact": {
      "telephone": "+596 596 66 06 66",
      "email": "contact@lapagerie.com",
      "siteWeb": "http://www.lapagerie.com"
    },
    "equipements": [
      "Piscine",
      "Wi-Fi gratuit",
      "Restaurant",
      "Salle de fitness",
      "Spa"
    ]
  },
  {
    "id": "hotel-97231-002",
    "nom": "Hôtel Bakoua",
    "description": "Situé sur la plage, cet hôtel offre une vue imprenable sur la mer des Caraïbes.",
    "adresse": {
      "ligne1": "Avenue des Arawaks",
      "ligne2": "",
      "codePostal": "97229",
      "ville": "Les Trois-Îlets",
      "pays": "France"
    },
    "coordonnees": {
      "latitude": 14.5921,
      "longitude": -60.8834
    },
    "classement": "4 étoiles",
    "contact": {
      "telephone": "+596 596 66 66 00",
      "email": "info@hotelbakoua.com",
      "siteWeb": "http://www.hotelbakoua.com"
    },
    "equipements": [
      "Plage privée",
      "Restaurant",
      "Bar",
      "Salle de conférence",
      "Wi-Fi gratuit"
    ]
  },
  {
    "id": "hotel-97231-003",
    "nom": "Résidence Les Amandiers",
    "description": "Résidence offrant des appartements entièrement équipés avec vue sur la mer.",
    "adresse": {
      "ligne1": "Route des Trois-Îlets",
      "ligne2": "",
      "codePostal": "97229",
      "ville": "Les Trois-Îlets",
      "pays": "France"
    },
    "coordonnees": {
      "latitude": 14.5902,
      "longitude": -60.8787
    },
    "classement": "3 étoiles",
    "contact": {
      "telephone": "+596 596 66 04 04",
      "email": "contact@amandiers.com",
      "siteWeb": "http://www.amandiers.com"
    },
    "equipements": [
      "Piscine",
      "Wi-Fi gratuit",
      "Cuisine équipée",
      "Terrasse",
      "Jardin"
    ]
  },
  {
    "id": "hotel-97231-004",
    "nom": "Hôtel La Dunette",
    "description": "Charmant hôtel en bord de mer, parfait pour une escapade tranquille.",
    "adresse": {
      "ligne1": "Quartier de l'Anse à l'Âne",
      "ligne2": "",
      "codePostal": "97229",
      "ville": "Les Trois-Îlets",
      "pays": "France"
    },
    "coordonnees": {
      "latitude": 14.5731,
      "longitude": -60.8874
    },
    "classement": "3 étoiles",
    "contact": {
      "telephone": "+596 596 66 09 09",
      "email": "contact@ladunette.com",
      "siteWeb": "http://www.ladunette.com"
    },
    "equipements": [
      "Restaurant",
      "Bar",
      "Terrasse",
      "Wi-Fi gratuit",
      "Accès à la plage"
    ]
  },
  {
    "id": "hotel-97231-005",
    "nom": "Hôtel Impératrice",
    "description": "Hôtel 3 étoiles avec vue sur la mer et accès à la plage, idéal pour les familles.",
    "adresse": {
      "ligne1": "Avenue de l'Impératrice",
      "ligne2": "",
      "codePostal": "97229",
      "ville": "Les Trois-Îlets",
      "pays": "France"
    },
    "coordonnees": {
      "latitude": 14.5925,
      "longitude": -60.8710
    },
    "classement": "3 étoiles",
    "contact": {
      "telephone": "+596 596 66 60 60",
      "email": "contact@imperatrice.com",
      "siteWeb": "http://www.imperatrice.com"
    },
    "equipements": [
      "Accès à la plage",
      "Wi-Fi gratuit",
      "Restaurant",
      "Salle de jeux",
      "Terrasse"
    ]
  },
  {
    "id": "hotel-97231-006",
    "nom": "Hôtel Carayou",
    "description": "Hôtel 4 étoiles avec accès direct à la plage, restaurant créole et piscine.",
    "adresse": {
      "ligne1": "Anse Mitan",
      "ligne2": "",
      "codePostal": "97229",
      "ville": "Les Trois-Îlets",
      "pays": "France"
    },
    "coordonnees": {
      "latitude": 14.5876,
      "longitude": -60.8775
    },
    "classement": "4 étoiles",
    "contact": {
      "telephone": "+596 596 66 09 09",
      "email": "contact@carayou.com",
      "siteWeb": "http://www.carayou.com"
    },
    "equipements": [
      "Plage privée",
      "Restaurant",
      "Bar",
      "Salle de sport",
      "Wi-Fi gratuit"
    ]
  }
]
